,id,title,bullets,tags,price,area,rooms,page,state
0,selObject_44628704,Wohnung im 2. G - 75 qm zu vermieten,"['Wohnung', '•', 'Neuenrade', 'Neuenrade']",[],Miete zzgl. NK 350 €,Wohnfläche ca. 75 m²,Zi. 4,185,5
1,selObject_44627714,Für Sie renoviert - ideal für die kleine Familie im...,"['Wohnung', '•', 'Duisburg', 'Obermeiderich']",[],Miete zzgl. NK 290 €,Wohnfläche ca. 55 m²,Zi. 3,185,5
2,selObject_44627708,"Helle 3-Zimmer-Wohnung mit Balkon, 1. Etage, frisch...","['Wohnung', '•', 'Bad', 'Salzuflen', 'Ehrsen-Breden']",['Balkon'],Miete zzgl. NK 479 €,Wohnfläche ca. 74 m²,Zi. 3,185,5
3,selObject_44627706,frisch renovierte Wohnung zu vermieten!,"['Wohnung', '•', 'Neuenrade', 'Neuenrade']",['Balkon'],Miete zzgl. NK 439 €,Wohnfläche ca. 78 m²,"Zi. 3,5",185,5
4,selObject_44627702,"Helle 4-Zimmer-Wohnung mit Balkon, frisch saniert","['Wohnung', '•', 'Bad', 'Salzuflen', 'Ehrsen-Breden']",['Balkon'],Miete zzgl. NK 569 €,Wohnfläche ca. 92 m²,Zi. 4,185,5
5,selObject_44627676,Geräumige Wohnung zum Wohlfühlen,"['Etagenwohnung', '•', 'Duisburg', 'Beeck']",['Balkon'],"Miete zzgl. NK 367,71 €",Wohnfläche ca. 72 m²,Zi. 2,185,5
6,selObject_44626655,4 Zimmer mit Balkon über der Iserlohner Altstadt,"['Etagenwohnung', '•', 'Iserlohn', 'Zentrum']",['Balkon'],Miete zzgl. NK 469 €,Wohnfläche ca. 82 m²,Zi. 4,185,5
7,selObject_44626654,Tolle Aussicht inklusive - 3 Zimmer Wohnung in Hombruc...,"['Etagenwohnung', '•', 'Iserlohn', 'Hombruch']",['Balkon'],"Miete zzgl. NK 330,87 €",Wohnfläche ca. 76 m²,Zi. 3,185,5
8,selObject_44626647,Großzügige gemütliche Dachgeschosswohnung mit toller...,"['Etagenwohnung', '•', 'Gelsenkirchen', 'Bismarck']",[],"Miete zzgl. NK 301,51 €",Wohnfläche ca. 80 m²,"Zi. 3,5",185,5
9,selObject_44626643,Schicke 2-Zimmer-Wohnung mit Tageslichtbad und Balkon...,"['Etagenwohnung', '•', 'Herne', 'Wanne']",['Balkon'],Miete zzgl. NK 339 €,Wohnfläche ca. 47 m²,Zi. 2,185,5
10,selObject_44626639,Schöne Erdgeschosswohnung in Suderwich,"['Erdgeschosswohnung', '•', 'Recklinghausen', 'Suderwich']",[],Miete zzgl. NK 389 €,Wohnfläche ca. 63 m²,Zi. 2,185,5
11,selObject_44626563,"Das ist Ihre Wohnung! Nur einziehen, wie schön!","['Etagenwohnung', '•', 'Dortmund', 'Wickede']",['Balkon'],Miete zzgl. NK 429 €,Wohnfläche ca. 65 m²,Zi. 3,185,5
12,selObject_44626476,Bei VIVAWEST die Sonnenstrahlen auf dem eigenen Balkon...,"['Etagenwohnung', '•', 'Duisburg', 'Alt-Homberg']",['Balkon'],Miete zzgl. NK 432 €,Wohnfläche ca. 56 m²,"Zi. 2,5",185,5
13,selObject_44626469,Bei VIVAWEST die Sonnenstrahlen auf dem eigenen Balkon...,"['Etagenwohnung', '•', 'Gelsenkirchen', 'Ückendorf']",['Balkon'],"Miete zzgl. NK 310,68 €",Wohnfläche ca. 58 m²,"Zi. 2,5",185,5
14,selObject_44626464,Vier Wände zum Wohlfühlen mit WBS.,"['Erdgeschosswohnung', '•', 'Bochum', 'Innenstadt']","['Balkon', 'EBK']","Miete zzgl. NK 302,42 €",Wohnfläche ca. 58 m²,"Zi. 2,5",185,5
15,selObject_44626453,Hier schlägt besonders das Herz für Singles und Paare,"['Etagenwohnung', '•', 'Duisburg', 'Fahrn']",['Balkon'],Miete zzgl. NK 359 €,Wohnfläche ca. 54 m²,"Zi. 3,5",185,5
16,selObject_44623036,Zwei Zimmer Wohnung Lintertstr. 54 im 3.OG links,"['Etagenwohnung', '•', 'Aachen', 'Aachen']",[],Miete zzgl. NK 440 €,Wohnfläche ca. 50 m²,Zi. 2,185,5
17,selObject_44622626,"Kleine, zentral gelegene Wohnung mit neuem Tageslichtb...","['Etagenwohnung', '•', 'Hagen', 'Altenhagen']",['Garten'],Miete zzgl. NK 325 €,Wohnfläche ca. 49 m²,Zi. 2,185,5
18,selObject_44622621,*** FÜR SINGLE ODER PAAR - IN ABSOLUT ZENTRALER LAGE...,"['Etagenwohnung', '•', 'Essen', 'Frohnhausen']","['Balkon', 'EBK']",Miete zzgl. NK 398 €,Wohnfläche ca. 65 m²,Zi. 3,185,5
19,selObject_44622600,Traumhafte zwei Zimmer Wohnung im EG links Bezugsfrei...,"['Erdgeschosswohnung', '•', 'Aachen', 'Aachen']",[],Miete zzgl. NK 350 €,Wohnfläche ca. 43 m²,Zi. 2,185,5
20,selObject_44622407,"Nähe Bahnhof Essen-Süd, schönes großes Dach-Studio","['Wohnung', '•', 'Essen', 'Bergerhausen']",[],Miete zzgl. NK 510 €,Wohnfläche ca. 68 m²,"Zi. 2,5",185,5
21,selObject_44622299,Wunderschönes Apartment in einer ruhigen denkmalgeschü...,"['Apartment', '•', 'Krefeld', 'Traar']",[],Miete zzgl. NK 335 €,Wohnfläche ca. 35 m²,Zi. 1,185,5
22,selObject_44622297,Zentrale 3 Zimmer-Wohnung,"['Etagenwohnung', '•', 'Krefeld', 'Cracau']",[],Miete zzgl. NK 430 €,Wohnfläche ca. 72 m²,Zi. 3,185,5
23,selObject_44622121,"Kleine Wohnung bestehend aus 1 Schlafzimmer, Wohnküche...","['Wohnung', '•', 'Emmerich', 'Emmerich']",['Balkon'],Miete zzgl. NK 395 €,Wohnfläche ca. 60 m²,Zi. 2,185,5
24,selObject_44621972,"Originelle Wohnung, großes Wohnzimmer, Dachterrasse !","['Etagenwohnung', '•', 'Oberhausen', 'Stadtmitte']",[],Miete zzgl. NK 650 €,Wohnfläche ca. 101 m²,"Zi. 3,5",185,5
25,selObject_44621864,"Bad Salzuflen, sonnige Dachgeschosswohnung mit Gartena...","['Etagenwohnung', '•', 'Bad', 'Salzuflen', 'Innenstadt']","['Garten', 'EBK']",Miete zzgl. NK 520 €,Wohnfläche ca. 65 m²,Zi. 3,185,5
26,selObject_44621812,Wohnen in der Nähe vom Niederfeldsee!,"['Erdgeschosswohnung', '•', 'Essen', 'Altendorf']",['Balkon'],"Miete zzgl. NK 360,80 €",Wohnfläche ca. 59 m²,Zi. 2,185,5
